{"schema_version":"unirouter.release-state-identity.v1","release_sequence":9,"version":"1.1.9-source-evidence-conformance","canonical_commit":"1111111111111111111111111111111111111111","package_sha256":"sha256:2222222222222222222222222222222222222222222222222222222222222222","trusted_key_id":"release-conformance-01","database_schema":"000059_enterprise_access_provisioning","recorded_at":"2029-12-31T23:55:00Z","observed_at":"2029-12-31T23:59:00Z"}